{
  "$schema": "./verification-gap-register.schema.json",
  "schema_version": "semantic-guard-verification-gap-register/v0",
  "register_id": "verification-gap-register.canonical.v0",
  "source": {
    "locator": "verification-source.json",
    "content_digest": {
      "algorithm": "sha256",
      "value": "d4fc9da6c08244f190913450ebf9bbdcc777ae151aa2a8bc7781a89d683f520c"
    }
  },
  "denominator": {
    "included_fields": [
      "verification_items[].unproven_scope[]",
      "verification_items[].residual_risks[]",
      "implementation_conformance_items[].remaining_obligations[]"
    ],
    "identity_canonicalization": "sha256(canonical-json({item_id,gap_kind,content}))",
    "content_digest_algorithm": "sha256"
  },
  "gap_set_digest": {
    "algorithm": "sha256",
    "value": "fb8bfedc040f0e5bb7fc18e9ea53cb5fc0afb6ea44f2c87da452b238f5eb2a06"
  },
  "gaps": [
    {
      "gap_id": "gap.sha256.06d59a0366dccb99c531e970625952caecfbff456b5d7c2f0774f60174c8e3ca",
      "gap_kind": "verification_residual_risk",
      "source_locator": "verification-source.json#/verification_items/1/residual_risks/0",
      "item_ref": {
        "reference_kind": "ref",
        "entity_id": "verification.or01.engineering-knowledge-governance"
      },
      "content": "A target form may become self-referential if its engineering origin is not independently reviewable.",
      "content_digest": {
        "algorithm": "sha256",
        "value": "de3b4e85c01d4643dce4835ee548ef299b9a08b632a631b590a7cc908cf7d14d"
      },
      "disposition": {
        "kind": "canonical_unresolved",
        "unresolved_ref": {
          "reference_kind": "ref",
          "entity_id": "unresolved.engineering-rule-pack-governance"
        }
      }
    },
    {
      "gap_id": "gap.sha256.0763d3eb371fbceae2622315156ab8cddbd84f6ac0a6833f0de7a89e5630cfd8",
      "gap_kind": "verification_unproven_scope",
      "source_locator": "verification-source.json#/verification_items/9/unproven_scope/0",
      "item_ref": {
        "reference_kind": "ref",
        "entity_id": "verification.cross.secure-and-responsible-operation"
      },
      "content": "Data classification, consent or authority, provider egress, minimization, secret and personal-data controls, retention and deletion, prompt-injection resistance, dependency and model provenance, least privilege, incident response, and independent review.",
      "content_digest": {
        "algorithm": "sha256",
        "value": "495a6c315f0bc655bc8c61ee9a7f2c21cc223c5f20d3ae845ebd2e8c855de570"
      },
      "disposition": {
        "kind": "canonical_unresolved",
        "unresolved_ref": {
          "reference_kind": "ref",
          "entity_id": "unresolved.secure-information-handling-and-external-boundaries"
        }
      }
    },
    {
      "gap_id": "gap.sha256.0c209b62828224d94922aaaa46b8e82ca238b26f9ebe7f1e447a3a8ed28cbb3e",
      "gap_kind": "verification_unproven_scope",
      "source_locator": "verification-source.json#/verification_items/1/unproven_scope/0",
      "item_ref": {
        "reference_kind": "ref",
        "entity_id": "verification.or01.engineering-knowledge-governance"
      },
      "content": "Clause-complete mapping, interpretation governance, organizational adoption, exception expiry, and review cadence.",
      "content_digest": {
        "algorithm": "sha256",
        "value": "b44aef2f446ce45ebf78cbe7196b37cbaffb69970263c9c8da426eeffa868e06"
      },
      "disposition": {
        "kind": "canonical_unresolved",
        "unresolved_ref": {
          "reference_kind": "ref",
          "entity_id": "unresolved.engineering-rule-pack-governance"
        }
      }
    },
    {
      "gap_id": "gap.sha256.1c37e35a43e232a296eabc47c38d851bc197df40c1272bf646da3cd94e793e6f",
      "gap_kind": "verification_unproven_scope",
      "source_locator": "verification-source.json#/verification_items/12/unproven_scope/0",
      "item_ref": {
        "reference_kind": "ref",
        "entity_id": "verification.cross.register-completeness"
      },
      "content": "Denominator adoption, stable gap registration, disposition closure, negative omission detection, independent review, and projection value equivalence.",
      "content_digest": {
        "algorithm": "sha256",
        "value": "04af504172313bcb6942a55501cfc0ca37c699edde9eaa0ac6faed7761406891"
      },
      "disposition": {
        "kind": "canonical_unresolved",
        "unresolved_ref": {
          "reference_kind": "ref",
          "entity_id": "unresolved.verification-register-completeness"
        }
      }
    },
    {
      "gap_id": "gap.sha256.204d1083fd18f66c48c963f53ff7a890a63ab9cda09b6674ccaf86dfff32c0c6",
      "gap_kind": "conformance_remaining_obligation",
      "source_locator": "verification-source.json#/implementation_conformance_items/18/remaining_obligations/0",
      "item_ref": {
        "reference_kind": "ref",
        "entity_id": "conformance.stage.dependency-analysis-bundle"
      },
      "content": "Provide coreference capability or revise the required bundle by human decision.",
      "content_digest": {
        "algorithm": "sha256",
        "value": "82ea44bb5503eec59156cfc9e9a5a59dccb5657f6793ef3bb745541641c42572"
      },
      "disposition": {
        "kind": "canonical_unresolved",
        "unresolved_ref": {
          "reference_kind": "ref",
          "entity_id": "unresolved.analyzer-route-effectiveness-and-incremental-value"
        }
      }
    },
    {
      "gap_id": "gap.sha256.2079ac92c2061a70fcba3caa310419d05b045bf93ca0c318108e1ecbc2ad64c8",
      "gap_kind": "conformance_remaining_obligation",
      "source_locator": "verification-source.json#/implementation_conformance_items/18/remaining_obligations/1",
      "item_ref": {
        "reference_kind": "ref",
        "entity_id": "conformance.stage.dependency-analysis-bundle"
      },
      "content": "Evaluate practical dependency and scope accuracy.",
      "content_digest": {
        "algorithm": "sha256",
        "value": "8f09cc176fa8393b7a2add38028cedd21ec973b39bc9bd178cf038ffb7c16788"
      },
      "disposition": {
        "kind": "canonical_unresolved",
        "unresolved_ref": {
          "reference_kind": "ref",
          "entity_id": "unresolved.analyzer-route-effectiveness-and-incremental-value"
        }
      }
    },
    {
      "gap_id": "gap.sha256.2d49e0413989bf319d02b80dafc436cb82c47957b71cb0dc6a684dba1690df31",
      "gap_kind": "conformance_remaining_obligation",
      "source_locator": "verification-source.json#/implementation_conformance_items/26/remaining_obligations/0",
      "item_ref": {
        "reference_kind": "ref",
        "entity_id": "conformance.migration.legacy-characterization"
      },
      "content": "Classify each material old/new semantic difference under independent review.",
      "content_digest": {
        "algorithm": "sha256",
        "value": "24030a14308ec6e8896c3aedbfd052553d09d564b9716285f677541d9f742572"
      },
      "disposition": {
        "kind": "canonical_unresolved",
        "unresolved_ref": {
          "reference_kind": "ref",
          "entity_id": "unresolved.evidence-expiry-and-requalification"
        }
      }
    },
    {
      "gap_id": "gap.sha256.2edc84ef03930e20f6f263fa5ba98040df091bde5277d58970cedb4f31562c6b",
      "gap_kind": "conformance_remaining_obligation",
      "source_locator": "verification-source.json#/implementation_conformance_items/23/remaining_obligations/0",
      "item_ref": {
        "reference_kind": "ref",
        "entity_id": "conformance.completeness.provider-accounting"
      },
      "content": "Add semantic performance evidence and operational failure cases.",
      "content_digest": {
        "algorithm": "sha256",
        "value": "57474e76511373ce6d51c40507dd10724c4e1a9c2e44c91cd52200112bf4d30c"
      },
      "disposition": {
        "kind": "canonical_unresolved",
        "unresolved_ref": {
          "reference_kind": "ref",
          "entity_id": "unresolved.analyzer-route-effectiveness-and-incremental-value"
        }
      }
    },
    {
      "gap_id": "gap.sha256.322696198e9ff20b3bcab86a660bb6e79b5f2ca804efb1e6ce486c6991d1a4c1",
      "gap_kind": "verification_unproven_scope",
      "source_locator": "verification-source.json#/verification_items/15/unproven_scope/0",
      "item_ref": {
        "reference_kind": "ref",
        "entity_id": "verification.cross.transition-and-cutover"
      },
      "content": "Transition contract, compatibility window, shadow comparison, evidence migration, rollback rehearsal, abort criteria, human cutover decision, and predecessor retirement.",
      "content_digest": {
        "algorithm": "sha256",
        "value": "831d9182d2602f81db3f2cd52b6c73798a56df2c86e6aa21ed9f6fc9186f7b91"
      },
      "disposition": {
        "kind": "canonical_unresolved",
        "unresolved_ref": {
          "reference_kind": "ref",
          "entity_id": "unresolved.transition-cutover-rollback-and-retirement"
        }
      }
    },
    {
      "gap_id": "gap.sha256.3a7bc810c90e70ae2a148ed8817886db315d31de5595f5b4dfc2d00bc9138164",
      "gap_kind": "conformance_remaining_obligation",
      "source_locator": "verification-source.json#/implementation_conformance_items/24/remaining_obligations/0",
      "item_ref": {
        "reference_kind": "ref",
        "entity_id": "conformance.completeness.public-result"
      },
      "content": "Add original-source rechecking and elevated provenance only where required.",
      "content_digest": {
        "algorithm": "sha256",
        "value": "61a9ad5091c0e4ba2b4a0304b32310ed29523bddc13b63896a77b020c5234b2f"
      },
      "disposition": {
        "kind": "canonical_unresolved",
        "unresolved_ref": {
          "reference_kind": "ref",
          "entity_id": "unresolved.state-evidence-derivation-and-subject-binding"
        }
      }
    },
    {
      "gap_id": "gap.sha256.3d86356637f1e05126bee6cce66a12359a66c45d02c80b53828556ef232a4416",